{
  "total_tokens": 84852,
  "duration_ms": 23332,
  "total_duration_seconds": 23.3,
  "executor_start": "2026-01-15T10:30:00Z",
  "executor_end": "2026-01-15T10:32:45Z",
  "executor_duration_seconds": 165.0,
  "grader_start": "2026-01-15T10:32:46Z",
  "grader_end": "2026-01-15T10:33:12Z",
  "grader_duration_seconds": 26.0
}
